[
  {
    "unit_id": "ghost-ark",
    "faction_id": "necrons",
    "models": [
      {
        "name": "Ghost Ark",
        "min": 1,
        "max": 1,
        "is_leader_model": false,
        "base_size_mm": {
          "shape": "flying-base",
          "size": "large",
          "draft": true,
          "width": 120,
          "length": 92
        },
        "default_weapon_ids": [
          "armoured-bulk",
          "gauss-flayer-array",
          "gauss-flayer-array"
        ]
      }
    ],
    "game_version": {
      "edition": "11th",
      "dataslate": "pre-launch-provisional"
    }
  },
  {
    "unit_id": "seraptek-heavy-construct",
    "faction_id": "necrons",
    "models": [
      {
        "name": "Seraptek Heavy Construct",
        "min": 1,
        "max": 1,
        "is_leader_model": false,
        "base_size_mm": {
          "shape": "hull",
          "draft": true
        },
        "default_weapon_ids": [
          "singularity-generator",
          "singularity-generator",
          "titanic-forelimbs"
        ]
      }
    ],
    "game_version": {
      "edition": "11th",
      "dataslate": "pre-launch-provisional"
    }
  },
  {
    "unit_id": "triarch-praetorians",
    "faction_id": "necrons",
    "models": [
      {
        "name": "Triarch Praetorians",
        "min": 5,
        "max": 10,
        "is_leader_model": false,
        "base_size_mm": {
          "shape": "round",
          "diameter": 32
        },
        "default_weapon_ids": [
          "rod-of-covenant"
        ]
      }
    ],
    "game_version": {
      "edition": "11th",
      "dataslate": "pre-launch-provisional"
    }
  },
  {
    "unit_id": "necron-warriors",
    "faction_id": "necrons",
    "models": [
      {
        "name": "Necron Warriors",
        "min": 10,
        "max": 20,
        "is_leader_model": false,
        "base_size_mm": {
          "shape": "round",
          "diameter": 32
        },
        "default_weapon_ids": [
          "close-combat-weapon",
          "gauss-flayer"
        ]
      }
    ],
    "game_version": {
      "edition": "11th",
      "dataslate": "pre-launch-provisional"
    }
  },
  {
    "unit_id": "canoptek-macrocytes",
    "faction_id": "necrons",
    "models": [
      {
        "name": "Canoptek Macrocytes",
        "min": 5,
        "max": 5,
        "is_leader_model": false,
        "base_size_mm": {
          "shape": "round",
          "diameter": 28.5
        },
        "default_weapon_ids": [
          "claws",
          "gauss-scalpel"
        ]
      }
    ],
    "game_version": {
      "edition": "11th",
      "dataslate": "pre-launch-provisional"
    }
  },
  {
    "unit_id": "technomancer",
    "faction_id": "necrons",
    "models": [
      {
        "name": "Technomancer",
        "min": 1,
        "max": 1,
        "is_leader_model": false,
        "base_size_mm": {
          "shape": "round",
          "diameter": 50
        },
        "default_weapon_ids": [
          "staff-of-light"
        ]
      }
    ],
    "game_version": {
      "edition": "11th",
      "dataslate": "pre-launch-provisional"
    }
  },
  {
    "unit_id": "night-scythe",
    "faction_id": "necrons",
    "models": [
      {
        "name": "Night Scythe",
        "min": 1,
        "max": 1,
        "is_leader_model": false,
        "base_size_mm": {
          "shape": "oval",
          "width": 120,
          "length": 92
        },
        "default_weapon_ids": [
          "twin-tesla-destructor",
          "armoured-bulk"
        ]
      }
    ],
    "game_version": {
      "edition": "11th",
      "dataslate": "pre-launch-provisional"
    }
  },
  {
    "unit_id": "overlord",
    "faction_id": "necrons",
    "models": [
      {
        "name": "Overlord",
        "min": 1,
        "max": 1,
        "is_leader_model": false,
        "base_size_mm": {
          "shape": "round",
          "diameter": 40
        },
        "default_weapon_ids": [
          "tachyon-arrow",
          "overlords-blade"
        ]
      }
    ],
    "game_version": {
      "edition": "11th",
      "dataslate": "pre-launch-provisional"
    }
  },
  {
    "unit_id": "royal-warden",
    "faction_id": "necrons",
    "models": [
      {
        "name": "Royal Warden",
        "min": 1,
        "max": 1,
        "is_leader_model": false,
        "base_size_mm": {
          "shape": "round",
          "diameter": 32
        },
        "default_weapon_ids": [
          "relic-gauss-blaster",
          "close-combat-weapon"
        ]
      }
    ],
    "game_version": {
      "edition": "11th",
      "dataslate": "pre-launch-provisional"
    }
  },
  {
    "unit_id": "canoptek-doomstalker",
    "faction_id": "necrons",
    "models": [
      {
        "name": "Canoptek Doomstalker",
        "min": 1,
        "max": 1,
        "is_leader_model": false,
        "base_size_mm": {
          "shape": "round",
          "diameter": 90
        },
        "default_weapon_ids": [
          "twin-gauss-flayer",
          "doomstalker-limbs",
          "doomsday-blaster"
        ]
      }
    ],
    "game_version": {
      "edition": "11th",
      "dataslate": "pre-launch-provisional"
    }
  },
  {
    "unit_id": "immortals",
    "faction_id": "necrons",
    "models": [
      {
        "name": "Immortals",
        "min": 5,
        "max": 10,
        "is_leader_model": false,
        "base_size_mm": {
          "shape": "round",
          "diameter": 32
        },
        "default_weapon_ids": [
          "gauss-blaster",
          "close-combat-weapon"
        ]
      }
    ],
    "game_version": {
      "edition": "11th",
      "dataslate": "pre-launch-provisional"
    }
  },
  {
    "unit_id": "cryptothralls",
    "faction_id": "necrons",
    "models": [
      {
        "name": "Cryptothralls",
        "min": 2,
        "max": 2,
        "is_leader_model": false,
        "base_size_mm": {
          "shape": "round",
          "diameter": 32
        },
        "default_weapon_ids": [
          "scouring-eye",
          "scythed-limbs"
        ]
      }
    ],
    "game_version": {
      "edition": "11th",
      "dataslate": "pre-launch-provisional"
    }
  },
  {
    "unit_id": "orikan-the-diviner",
    "faction_id": "necrons",
    "models": [
      {
        "name": "Orikan the Diviner",
        "min": 1,
        "max": 1,
        "is_leader_model": false,
        "base_size_mm": {
          "shape": "round",
          "diameter": 40
        },
        "default_weapon_ids": [
          "staff-of-tomorrow"
        ]
      }
    ],
    "game_version": {
      "edition": "11th",
      "dataslate": "pre-launch-provisional"
    }
  },
  {
    "unit_id": "tesseract-vault",
    "faction_id": "necrons",
    "models": [
      {
        "name": "Tesseract Vault",
        "min": 1,
        "max": 1,
        "is_leader_model": false,
        "base_size_mm": {
          "shape": "oval",
          "width": 120,
          "length": 92
        },
        "default_weapon_ids": [
          "tesla-sphere",
          "tesla-sphere",
          "tesla-sphere",
          "tesla-sphere",
          "armoured-bulk",
          "tesla-spheres"
        ]
      }
    ],
    "game_version": {
      "edition": "11th",
      "dataslate": "pre-launch-provisional"
    }
  },
  {
    "unit_id": "tomb-blades",
    "faction_id": "necrons",
    "models": [
      {
        "name": "Tomb Blades",
        "min": 3,
        "max": 6,
        "is_leader_model": false,
        "base_size_mm": {
          "shape": "flying-base",
          "size": "small",
          "draft": true
        },
        "default_weapon_ids": [
          "twin-gauss-blaster",
          "shieldvanes",
          "close-combat-weapon"
        ]
      }
    ],
    "game_version": {
      "edition": "11th",
      "dataslate": "pre-launch-provisional"
    }
  },
  {
    "unit_id": "psychomancer",
    "faction_id": "necrons",
    "models": [
      {
        "name": "Psychomancer",
        "min": 1,
        "max": 1,
        "is_leader_model": false,
        "base_size_mm": {
          "shape": "round",
          "diameter": 40
        },
        "default_weapon_ids": [
          "abyssal-lance"
        ]
      }
    ],
    "game_version": {
      "edition": "11th",
      "dataslate": "pre-launch-provisional"
    }
  },
  {
    "unit_id": "lokhust-heavy-destroyers",
    "faction_id": "necrons",
    "models": [
      {
        "name": "Lokhust Heavy Destroyers",
        "min": 1,
        "max": 3,
        "is_leader_model": false,
        "base_size_mm": {
          "shape": "round",
          "diameter": 60
        },
        "default_weapon_ids": [
          "close-combat-weapon",
          "enmitic-exterminator"
        ]
      }
    ],
    "game_version": {
      "edition": "11th",
      "dataslate": "pre-launch-provisional"
    }
  },
  {
    "unit_id": "skorpekh-destroyers",
    "faction_id": "necrons",
    "models": [
      {
        "name": "Skorpekh Destroyers",
        "min": 3,
        "max": 6,
        "is_leader_model": false,
        "base_size_mm": {
          "shape": "round",
          "diameter": 50
        },
        "default_weapon_ids": [
          "skorpekh-hyperphase-weapons"
        ]
      }
    ],
    "game_version": {
      "edition": "11th",
      "dataslate": "pre-launch-provisional"
    }
  },
  {
    "unit_id": "convergence-of-dominion",
    "faction_id": "necrons",
    "models": [
      {
        "name": "Convergence of Dominion",
        "min": 1,
        "max": 3,
        "is_leader_model": false,
        "base_size_mm": {
          "shape": "hull",
          "draft": true
        },
        "default_weapon_ids": [
          "transdimensional-abductor"
        ]
      }
    ],
    "game_version": {
      "edition": "11th",
      "dataslate": "pre-launch-provisional"
    }
  },
  {
    "unit_id": "skorpekh-lord",
    "faction_id": "necrons",
    "models": [
      {
        "name": "Skorpekh Lord",
        "min": 1,
        "max": 1,
        "is_leader_model": false,